{"artifacts":[{"byte_count":58011,"gid":1035,"logical_name":"run.jsonl","mode":"0400","nlink":1,"original_mode":"0664","original_path":"/shared/linqiang/mobileworld_causal_replay_data/g1_gpu_smoke/direct-gpu4-qwen-mai-20260831-productionprompt/run.jsonl","original_physically_immutable":false,"sealed_object_path":"/shared/linqiang/mobileworld_causal_replay_data/g1_gpu_smoke/g1_4_engineering_close_20260831/evidence/objects/sha256/27/27c97d1f29119e9b3a087e756814e64fb9b822d829135b1af4b747468a7e38cd","sha256":"27c97d1f29119e9b3a087e756814e64fb9b822d829135b1af4b747468a7e38cd","uid":1035},{"byte_count":16204,"gid":1035,"logical_name":"qwen.server.log","mode":"0400","nlink":1,"original_mode":"0664","original_path":"/shared/linqiang/mobileworld_causal_replay_data/g1_gpu_smoke/direct-gpu4-qwen-mai-20260831-productionprompt/qwen.server.log","original_physically_immutable":false,"sealed_object_path":"/shared/linqiang/mobileworld_causal_replay_data/g1_gpu_smoke/g1_4_engineering_close_20260831/evidence/objects/sha256/ce/ce511552f520e631f42b79fe8bbb7e4a45e12646ae463969f1de3e4bc3604f71","sha256":"ce511552f520e631f42b79fe8bbb7e4a45e12646ae463969f1de3e4bc3604f71","uid":1035},{"byte_count":15963,"gid":1035,"logical_name":"mai.server.log","mode":"0400","nlink":1,"original_mode":"0664","original_path":"/shared/linqiang/mobileworld_causal_replay_data/g1_gpu_smoke/direct-gpu4-qwen-mai-20260831-productionprompt/mai.server.log","original_physically_immutable":false,"sealed_object_path":"/shared/linqiang/mobileworld_causal_replay_data/g1_gpu_smoke/g1_4_engineering_close_20260831/evidence/objects/sha256/69/6996c4f1d6b938a2b7a48f10d45a44d086cd71695cbf47cfc669e0a670d8a2a0","sha256":"6996c4f1d6b938a2b7a48f10d45a44d086cd71695cbf47cfc669e0a670d8a2a0","uid":1035}],"binding_provenance":{"contemporaneous_source_binding":false,"live_run_recorded_runtime_hashes":false,"live_run_recorded_source_hashes":false,"post_hoc_association":true},"claims":{"backend_isolation_proven":false,"contemporaneous_source_and_runtime_binding":false,"engineering_delivery_complete":true,"execution_ready":false,"formal_live_proof":false,"formal_provider_codec_accepted":false,"formal_replay_performed":false,"formal_replay_ready":false,"formal_serving_environment_matched":false,"further_gpu_authorized":false,"g15_complete":false,"g16_formal_admission_present":false,"g17_run_ready":false,"generated_action_executed":false,"live_transport_validation_complete":false,"nonformal_live_smoke_passed":true,"original_evidence_physically_immutable":false,"post_hoc_scope_amendment":true,"post_hoc_source_and_runtime_association":true,"provider_invocation_allowed":false,"reusable_gpu_authority_granted":false,"sealed_evidence_copies_read_only":true,"treatment_response_generated":false,"treatment_response_generation_allowed":false},"decision_id":"D-035","deferred_to_g1_7":["backend_dependency_none_proof","exact_frozen_serving_environment","formal_openai_compatible_provider_codec","full_attempt_usage_latency_error_delivery_receipts","g1_7_run_ready_execution_and_formal_replay_seals","population_statistical_replay","sdk_hidden_retry_fidelity","session_kv_and_fresh_invocation_isolation"],"engineering_close_status":"NONFORMAL_LIVE_SMOKE_PASSED","evidence_root":"/shared/linqiang/mobileworld_causal_replay_data/g1_gpu_smoke/g1_4_engineering_close_20260831/evidence","formal_replay_status":"DEFERRED_TO_G1_7_NOT_AUTHORIZED","historical_chain":{"last_commit_containing_obsolete_d034_contracts":"60835447601cacbfae4c806b464b3247d555aeac","obsolete_d034_deletion_commit":"83e6cb847e62594f75ce4f6b47b3bae3337203d6","obsolete_shared_d034_root_deleted":true},"host_probe_provenance":{"formal_process_tree_release_receipt_available":false,"post_hoc_pid_absence_reverified":true,"post_hoc_process_tree_release_transcript_attested":true,"postflight_summary":{"foreign_pid":217927,"foreign_process_untouched":true,"foreign_uid":1030,"foreign_used_mib":62100,"gpu_free_mib":81045,"gpu_used_mib":62112,"gpu_utilization_percent":0,"owned_engine_pids":[247312,257754],"owned_pids_absent":true,"owned_root_pids":[244577,256742],"port_listener_absent":true},"raw_postflight_receipt_available":false,"raw_preflight_receipt_available":false,"source":"owner-authorized-main-tool-transcript-only"},"installation_receipt_path":"/shared/linqiang/mobileworld_causal_replay_data/g1_gpu_smoke/g1_4_engineering_close_20260831/install-receipt.v1.json","known_config_differences":[{"effect":"exact frozen environment equivalence is unproven","field":"ambient_child_environment","frozen":"closed reference environment","observed":"ambient environment inherited outside 15 explicit overrides"},{"effect":"the accepted smoke used the separately owner-authorized shared GPU4","field":"gpu_index","frozen":0,"observed":4},{"effect":"package-level serving-environment equivalence is unproven","field":"package_versions","frozen":{"flashinfer":null,"torch":"2.8.0+cu126","transformers":"4.57.4"},"observed":{"flashinfer-python":"0.6.6","torch":"2.10.0","transformers":"5.6.0"}},{"effect":"interpreter and environment equivalence is unproven","field":"python_environment","frozen":"frozen reference runtime","observed":"shared Miniconda Python 3.12 plus vllm_env site-packages"},{"effect":"timeout behavior is compatibility-only","field":"request_timeout_seconds","frozen":120,"observed":180},{"effect":"swap-space configuration equivalence is unproven","field":"swap_space_gib","frozen":0,"observed":"flag omitted because vLLM 0.19.1 rejected it"},{"effect":"formal Provider Codec and SDK fidelity are unproven","field":"transport_and_sdk","frozen":"OpenAI SDK 1.106.1 Provider Codec","observed":"Python stdlib http.client; installed OpenAI 2.32.0 unused"},{"effect":"exact frozen serving-runtime equivalence is unproven","field":"vllm_version","frozen":"0.11.0","observed":"0.19.1"}],"manifest_id":"g14smoke-27c97d1f29119e9b3a087e75","matched_controls":["dtype_bfloat16","enforce_eager_true","fixture_call_order_and_metadata","gpu_memory_utilization_0.24","loopback_127.0.0.1_port_18007","max_model_len_32768","max_num_seqs_1","model_snapshot_paths_and_served_names","prefix_caching_disabled","production_host_parser_sources","production_system_prompt_sources","request_model_temperature_and_seed_schedule"],"run_summary":{"call_succeeded_count":22,"event_count":52,"failure_event_count":0,"first_sequence":0,"g14_canary_call_count":12,"g15_codec_call_count":10,"generated_action_execution_count":0,"last_sequence":51,"mai_call_count":11,"production_host_parser_projection_count":22,"qwen_call_count":11,"qwen_stopped_before_mai_started":true,"raw_response_persisted_before_parse":true,"response_received_count":22,"retry_count":0,"same_seed_repeat_content_equal":true,"successful_call_count":22},"runtime":{"child_environment_overrides":{"CUDA_VISIBLE_DEVICES":"4","DO_NOT_TRACK":"1","HF_HUB_DISABLE_TELEMETRY":"1","HF_HUB_OFFLINE":"1","NO_PROXY":"127.0.0.1,localhost","PYTHONDONTWRITEBYTECODE":"1","PYTHONNOUSERSITE":"1","PYTHONPATH":"/shared/linqiang/MobileWorld/vllm_env/lib/python3.12/site-packages","PYTHONSAFEPATH":"1","TRANSFORMERS_OFFLINE":"1","TRITON_CUOBJDUMP_PATH":"/usr/local/cuda/bin/cuobjdump","TRITON_NVDISASM_PATH":"/usr/local/cuda/bin/nvdisasm","TRITON_PTXAS_PATH":"/usr/local/cuda/bin/ptxas","VLLM_NO_USAGE_STATS":"1","no_proxy":"127.0.0.1,localhost"},"gpu_index":4,"gpu_uuid":"GPU-36c832f8-4901-c89c-3c40-8d8b9825661d","host":"127.0.0.1","models":[{"engine_pid":247312,"model_id":"qwen3vl_8b","root_pid":244577,"served_name":"Qwen3-VL-8B-Instruct","server_argv":["/shared/miniconda3/bin/python3.12","-P","-B","-m","vllm.entrypoints.cli.main","serve","/shared/huggingface/hub/models--Qwen--Qwen3-VL-8B-Instruct/snapshots/0c351dd01ed87e9c1b53cbc748cba10e6187ff3b","--served-model-name","Qwen3-VL-8B-Instruct","--host","127.0.0.1","--port","18007","--dtype","bfloat16","--max-model-len","32768","--enforce-eager","--gpu-memory-utilization","0.24","--limit-mm-per-prompt","{\"image\":3,\"video\":0}","--mm-processor-cache-gb","1","--max-num-batched-tokens","8192","--max-num-seqs","1","--tensor-parallel-size","1","--pipeline-parallel-size","1","--data-parallel-size","1","--seed","0","--no-enable-prefix-caching","--tokenizer-mode","auto","--no-trust-remote-code","--load-format","auto","--kv-cache-dtype","auto","--generation-config","auto"],"snapshot":"/shared/huggingface/hub/models--Qwen--Qwen3-VL-8B-Instruct/snapshots/0c351dd01ed87e9c1b53cbc748cba10e6187ff3b"},{"engine_pid":257754,"model_id":"mai_ui_8b","root_pid":256742,"served_name":"MAI-UI-8B","server_argv":["/shared/miniconda3/bin/python3.12","-P","-B","-m","vllm.entrypoints.cli.main","serve","/shared/linqiang/hf_home/hub/models--Tongyi-MAI--MAI-UI-8B/snapshots/e00a0097abb9cc621cac5172d8c4809f0839c94e","--served-model-name","MAI-UI-8B","--host","127.0.0.1","--port","18007","--dtype","bfloat16","--max-model-len","32768","--enforce-eager","--gpu-memory-utilization","0.24","--limit-mm-per-prompt","{\"image\":3,\"video\":0}","--mm-processor-cache-gb","1","--max-num-batched-tokens","8192","--max-num-seqs","1","--tensor-parallel-size","1","--pipeline-parallel-size","1","--data-parallel-size","1","--seed","0","--no-enable-prefix-caching","--tokenizer-mode","auto","--no-trust-remote-code","--load-format","auto","--kv-cache-dtype","auto","--generation-config","auto"],"snapshot":"/shared/linqiang/hf_home/hub/models--Tongyi-MAI--MAI-UI-8B/snapshots/e00a0097abb9cc621cac5172d8c4809f0839c94e"}],"port":18007,"request_path":"/v1/chat/completions","request_timeout_seconds":180.0,"runner_invocation":{"byte_count":30598912,"lexical_path":"/shared/linqiang/agent_monitor/AgentSentinel/MobileWorld/.venv/bin/python","resolved_path":"/shared/miniconda3/bin/python3.12","sha256":"c8713e1542ddc561e7e1d889e4124029549fbaf5c70244db030458dc9aab5ecc","symlink_target":"/shared/miniconda3/bin/python3"},"server_python":{"byte_count":30598912,"path":"/shared/miniconda3/bin/python3.12","resolved_path":"/shared/miniconda3/bin/python3.12","sha256":"c8713e1542ddc561e7e1d889e4124029549fbaf5c7